what are the 4 main classes of biomolecules,nucleic acids<br>proteins<br>carbohydrates<br>lipids,0,,
describe the neurochemistry of alzheimers with reference to NTs,ACh - deficit in central cholinergic transmission:<br>- neuronal loss<br>- ⇓ choline acetyltransferase (synthesis)<br>- ⇓ AChE<br>- ⇓ choline uptake<br>Amines:<br>- ⇓ NA synthesis (from loss of cells in locus coeruleus)<br>- ⇓ 5HT synthesis (from loss of cells in raphe nuclei)<br>Glutamate:<br>- ⇓ glutamate transporters<br>- ⇑ excitotoxicity,,,
describe the genetics of alzheimers&nbsp;,"≥95% cases of alzheimers are sporadic (no genetic basis)<br>- amyloid precursor protein gene on chromosome 21<br>- presenelins (PS1 and PS2) genes on chromosome 1, 14 --&gt; may effect processing of APP (more Ab<sub>42 </sub>and Ab<sub>40</sub>, Ab<sub>42</sub> most commonly found in amyloid plaques)<br>- apolipoprotein (apoE) --&gt; determines age of onset. ε4 allele = onset in 80s, ε3 allele = onset in 90s",,,
identify different pharmacological treatments for alzheimers,"- cholinesterase inhibitors<br>- NMDA antagonist&nbsp;<br>- antidepressants<br>- β-secretase inhibitors (alters peptide cleavage to produce less Ab42) --&gt; experimental, low efficacy<br>- statins (prophylactic?) --&gt; cholesterol plays a role in APP synthesis<br>- Aducanumab --&gt; immunotherapy targets Aβ plaques in ppl w alzheimers to reduce their build up. serious side effects",,,
what happens when you react two glucose molecules? draw the curly arrow mechanism and name the product,"product is a disaccharide. similar to formation of a glycoside but the alcohol is just a substituent of glucose ring.<br><img src=""paste-2059be3cc5f6a22b67aa383941e8c3a3e138b03c.jpg"">",,,
what is an amino sugar?,"where an -OH group of a sugar is replaced by -NH2<br>this can be further functionalised by acetylation<br><img src=""paste-52a65aa48d810f05f6b20239573e4fb64de8562b.jpg"">",,,
"starch, glycogen and cellulose are all polymers of glucose. what makes them different from each other?","have different chain branching patterns<br>e.g. starch branches ⍺(1--&gt;6)&nbsp;<br><img src=""paste-b954b5a2cc52d1d169f23f48ee68464757aff286.jpg"">NB: in glycogen m=6-12<br>e.g. cellulose has β(1--&gt;4) linkage (no branching?). therefore humans cant get energy from cellulose bc we dont have the enzyme to hydrolyse this bond<br><img src=""paste-64d8336b05384063a14777d4d373579537e67d21.jpg"">",,,
describe how sugars determine blood type,#NAME?,,,
give some examples of sugars being used as drugs,"1. mannitol --&gt; osmotic agent, draws water into airways, useful in improving lung function in CF<br>2. penicillin --&gt; bacterias have sugars we dont have (NAM and NAG). penicillin inteferes w NAM branching",,,
why do sugars cause a sweet taste?,they contain the right # of H bond donors and H bond acceptors to interact w GPCRs to cause signalling cascade to brain that is interpreted as sweet tasting,,,
describe the role of cyclodextrins in food and give an example,cyclodextrin = cyclic polysaccharide which has a cavity that can bind molecules.&nbsp;<br>e.g. cholesterol free eggs:<br>1. whites &amp; yolks are separated<br>2. β-cyclodextrin is mixed w yolks to create a crystalline complex of β-cyclodextrin and cholesterol which is removed w centrifugion<br>3. add yolks and whites together and you have cholesterol free eggs,,,
describe the maillard reaction,"upon heating, amino acids react w reducing sugars<br>then form an imine then undergo amadori rearrangement (aldose --&gt; ketose)<br>then a sequence of rxns occur to form aromatic products that are responsible for the colour and taste of many diff foods",,,
what are lipids,#NAME?,,,
what are some functions of lipids,"1. storage --&gt; of energy<br>2. membranes --&gt; water insolubility makes lipids excellent barriers for delineating cells and organelles<br>3. messengers --&gt; steroids, prostaglandins and thromboxanes are all lipids",,,
"identify this molecule<br><img src=""paste-7ff7b6047ad558ea74ab7f3e1f378d42575a7b7e.jpg"">",prostaglandin E2 (PGE2) --&gt; inflammatory mediator,,,
"identify this molecule<br><img src=""paste-763b596b2c675110980534e9b31c784d93e900f0.jpg"">",thromboxane A2,,,
"identify this molecule<br><img src=""paste-d25642dce3a2a0a6d02f7705fbab79673adf5040.jpg"">",estrogen,,,
"identify this molecule<br><img src=""paste-527e69ea3bdac74d1ef9e22a5623a7f7e88087ed.jpg"">",cholesterol,,,
"identify this molecule<br><img src=""paste-3bcec106eba9e88c85975602eb8cd2bbf8359383.jpg"">",testosterone,,,
describe the nomenclature of unsaturated fatty acids,"C(C chain length):(#double bonds) cis/trans Δ<sup>(number of carbons away from COOH that double bond is)<br></sup>e.g. C18:1 cis Δ<sup>9<br></sup><img src=""paste-cc7a0ca5bba34753756c1576239a0000e28a10c6.jpg"">",,,
saturated fatty acids have _____ melting &amp; boiling points<br>unsaturated fatty acids have ______ melting &amp; boiling points,1. high (bc they have 'straight' carbon chains which ⇑ dispersion forces)<br>2. low,,,
describe the three types of complex lipids and give their general structure,"1. glycerophospholipids<br><img src=""paste-d262131386ce954e840cce16eeb6ec2cf7319865.jpg""><br>2. sphingolipids<br><img src=""paste-a4717144b14aac35a1d99bc9544a0906cb92f43c.jpg""><br>3. glycolipids<br><img src=""paste-425e5ff91afddc00f2e07f27abef36c936b4d3cc.jpg"">",,,
which alcohols are usually found in glycerophospholipids/phosphoglycerides,ethanolamine<br>choline<br>serine<br>inositol,,,
if the alcohol in a glycerophospholipid is ethanolamine or serine what is the lipid called?,a cephalin,,,
if the alcohol in a glycerophospholipid is choline what is the lipid called?,lecithin,,,
describe the structure of sphingolipids,"built around the poly-ol sphingosine rather than glycerol<br><img src=""paste-179a7f7cf30ee1538dfa71a7bd0d15710f09597e.jpg"">",,,
describe the function of sphingomyelin,"component of myelin sheath, which insulates nerves",,,
describe the structure of glycolipids,glycerol backbone. contain a sugar (can be mono or polysaccharide) but no phosphate<br>sphingoglycolipids have a sphingosine scaffold but contain a sugar&nbsp;,,,
describe the different structures than can arise from lipid self&nbsp;,planar bilayer sheet&nbsp;<br>micelle = spherical single layer<br>liposome = spherical bilayer,,,
describe how lipid structure influences phase transitions,phase transition temperature = T<sub>t<br></sub>- saturated FAs have ⇑T<sub>t&nbsp;</sub>bc ⇑VDW forces and more efficient packing<br>- unsaturated FAs (particularly cis) have ⇓T<sub>t&nbsp;</sub>bc chain kink disturbs packing and ⇓VDW forces,,,
describe the basic principles of differential scanning calorimetry and its usage in detecting changes in phase,"heat a sample &amp; a reference continually and measure ΔT between them<br>if both have same heat capacity, ΔT&nbsp;= 0<br>if a phase change occurs, ΔT&nbsp;&gt; 0<br>this means the heat capacity of the sample, which you measure?",,,
what is the core ring system of steroid hormones and describe the numbering system,"<img src=""paste-764ac16b152a3bf181df11802c1b1d491e3e1cc2.jpg"">",,,
describe the biosynthetic origin and function of cholesterol,"- most important 'steroid' in human body<br>- made in the liver<br>- starting material for testosterone, estrogen, bile salts etc<br>- essential component of cell membrane (up to 50% of plasma membrane)<br>- modulated function of membrane proteins e.g. Na+/K+ ATPase",,,
describe how cholesterol is transported throughout the body,#NAME?,,,
"describe the difference between VLDL, LDL and HDL",VLDL = very low density lipoprotein<br>- produced by liver<br>- triglyceride rich<br>- pro-atherogenic&nbsp;<br>LDL = low density lipoprotein<br>- derived from VLDL/IDL and are even more enriched in cholesterol<br>- carries the majority of cholesterol thats in circulation<br>HDL = high density lipoprotein<br>- transports cholesterol to liver where its excreted as bile<br>- transports cholesterol to organs where it is used to synthesise hormones,,,
describe cholesterol transport by VLDL and LDL,- carry cholesterol from liver to body<br>- LDL receptors on cells 'meet and greet' LDL<br>- high levels of LDL in blood linked to atherosclerosis (deposition of lipids and cholesterol into arterial wall),,,
what is the MOA of statins?,#NAME?,,,
what is the biosynthetic origin of sex hormones,#NAME?,,,
describe the biosynthetic origin and function of bile salts,- products of cholesterol metabolism<br>- stereochemistry bottom face of molecule is hydrophilic and the top face is hydrophobic<br>- natural surfactants --&gt; solubilise fats and assist in their absorption,,,
describe the biosynthetic origin and function of prostaglandins,- synthesised from arachidonic acid (oxidative ring closure catalysed by cyclooxygenase)<br>- key signalling molecules:<br>--&gt; stimulate uterine contractions (labour)<br>--&gt; relax muscles around blood vessels (lower blood pressure),,,
describe the biosynthetic origin and function of thromboxane,- synthesised from PGH2<br>- signalling molecule<br>- induces platelet aggregation --&gt; first step in blood clotting,,,
describe the biosynthetic origin and function of leukotrienes,#NAME?,,,
describe membrane asymmetry with reference to the different types of lipids,#NAME?,,,
how is membrane asymmetry maintained,"flippases, flopases&nbsp;<br>ATP dependent enzymes which translocate phospholipids",,,
"describe which direction flippase, floppase and scramblase translocate phospholipids",flippase = outer leaflet --&gt; inner leaf<br>floppase = inner leaflet --&gt; outer leaflet<br>scramblase = antiporter,,,
describe how membrane asymmetry across different organisms can be exploited in medicine,- bacteria have different lipid distribution &amp; asymmetry in their membranes<br>- PE and PG are major lipid components of bacterial membranes. PC is major one in animals<br>- can use this fact to target specific bacteria with new antimicrobials,,,
describe how membrane asymmetry can be exploited in medicine,#NAME?,,,
describe the timescale of lipid movement in a membrane,"rotational lipid rocking 10<sup>-9</sup>s<br>lateral movement 10<sup>-6</sup>s<br>transverse ""flip flop"" 10<sup>5</sup>s (seldom happens w/o an enzyme)",,,
how is lipid rocking measured and describe the basic principles&nbsp;,"- measured using fluoresence anisotropy (FA)<br>- based off principle that light emitted by a fluorophore has unequal intensities along diff axes of polarisation<br>- measure FA (which is r) by fluoresence intensity<br>- calculate rotational correlation time ɸ (ie time for a molecule to rotate by one radian)<br><img src=""paste-5779ed1d2f722a6250ad2c5bc77fe1099575fc05.jpg"">",,,
how is lipid lateral movement measured and describe the basic principles&nbsp;,"- measure using fluoresence recovery after photobleaching (FRAP)<br>- measures translational diffusion coefficients<br>- steps are bleach molecule of interest w fluoro tag (∴no more fluoresence), and time how bleached area recovers as non-bleached molecules diffuse in<br><img src=""paste-1f61a797b665ee88b41748037a20fe08994b525c.jpg""><br><img src=""paste-12bf73a79628cb644b318ee3f1e716ea91a00112.jpg"">",,,
how is lipid transverse movement measured and describe the basic principles&nbsp;,- measured using electron paramagnetic response spectroscopy<br>- determines kinetics of flip flop<br>- bascially add a nitroxide radical (paramagnetic) to some PCs in lipid bilayer --&gt; produces EPR signal<br>- add ascorbate which reduces nitroxide to be diagmagnetic --&gt; no EPR signal,,,
to form an ordered structure...,the energy of bond formation must overcome the randomising effect of kinetic energy&nbsp;,,,
what is the assembly of small molecules into organised structures governed by,"boltzmann distribution<br><img src=""paste-3f3a2ca6ecb80c781f6a11cf23847095efb6777b.jpg""><br>IMFs driving formation of structures must exceed thermal energy",,,
what determines whether a water-in-oil or oil-in-water emulsion will form?,"which is the major component of the mixture<br>if water --&gt; oil-in-water<br>if oil --&gt; water-in-oil (these are called&nbsp;<i>reverse micelles</i>)<br><img src=""paste-bc33520d3131c279252bfea81deee720edf02335.jpg"">",,,
how is soap prepared and how does it clean dirt?,"- saponification of fatty acids by treatment w NaOH gives 1 molecule of glycerol and 3 molecules of sodium sterate (which is a soap)<br>- sodium sterate can form micelles and encapsulate dirt<br><img src=""paste-a370bc96b779ad79c01c0bdd234a731ef06fc5a4.jpg"">",,,
describe how molecule structure determines structure shape,"- determined by critical packing parameter v/(a<sub>0</sub>l<sub>c</sub>), which relates volume of surfactant tail, area occupied by headgroup and length of surfactant tail<br>- if v/(a<sub>0</sub>l<sub>c</sub>) &lt; 1/3 --&gt; spherical micelle<br>- if 1/2 &lt; v/(a<sub>0</sub>l<sub>c</sub>) &lt; 1 --&gt; vesicle&nbsp;<br>- if v/(a<sub>0</sub>l<sub>c</sub>) = 1 --&gt; planar bilayer<br>- is v/(a<sub>0</sub>l<sub>c</sub>) &gt; 1 --&gt; reverse micelle",,,
describe the nature of gels,#NAME?,,,
describe the hydrophobic effect,"<img src=""paste-74aa102e5d85f9d546e9708befd9b218a4fec1c7.jpg"">",,,
describe π-π stacking,"when two π systems interact, they are not often face-to-face but staggered or offset --&gt; may be bc electrostatic replusion of e- clouds<br>∴its more of a π-σ attactraction<br><img src=""paste-7d8840e7e413e3cef80ae93066e87f1a604ec136.jpg""><br><img src=""paste-7399a92c5390e0dd2135c9c5b930646ab2e0547a.jpg"">",,,
describe the role of exciton theory π-π stacking and how this determines the colour of aromatic dyes,"- UV/Vis spec<br>- in a dimer, transition moments of monomers can be in phase or out of phase<br><img src=""paste-799109df024f8bc4694731d8854811d57d0b0f6e.jpg""><br>",,,
what is osmotic pressure,the amount of force applied to a solution that prevents solvent from moving across a semipermeable membrane.,,,
how is osmotic pressure measured&nbsp;,"- osmometer<br>- two chambers separated by semipermeable membrane<br>- each chamber has a capillary sticking up<br>- solvent flows to the solution side to produce hydrostatic pressure which opooses further flow<br>- π is calculated using difference of heights of liquid of the solutions<br><img src=""paste-625cf1663eef5679e49865a781a46f2c8e7475b2.jpg""><br>p=1x10<sup>3&nbsp;</sup>kg m<sup>-3</sup>",,,
how to calculate the osmotic pressure of an ideal solution,"<img src=""paste-33e98a163509f4886010a745b450044288371037.jpg""><br><img src=""paste-d561b89eb062b5290a42ea40640c0547a35b96fb.jpg"">",,,
what is an ideal solution,"<img src=""paste-adadaef11385cc1894620123294f187962099214.jpg""><br>enthalpy of mixing = 0",,,
what is chemical potential and how can it be used to understand osmotic pressure,"it is the gibbs free energy per mole of solute in solution (µ<sub>i</sub>)<br>water will flow from a high chemical potential (solvent) to low chemical potential (solution)<br>at equilibrium the chemical potential of a given component but be everywhere equal<br>in non-ideal conditions:<br><img src=""paste-5287c05be42de3eb98ab7b981757204aca6da5f1.jpg""><br><img src=""paste-402ce0d14430c0050e7c5c13499e16e5291585e6.jpg""><br>where gamma is just a correction factor called the activity coefficient (no units - is there so only the molecules contributing to chemical potential are contributing to ther eqn)",,,
describe the donnan effect,"the uneven distribution of ions across a cell membrane is due to the large amounts of impermable anionic macromolecules(mostly proteins) and organic phosphates in the cytoplasm<br>more K+ inside cell, more Cl- outside cell",,,
why must Na+ be continuously pumped out of cells?,⇓ # of particles in the cell<br>hence ⇓ osmotic pressure<br>prevents cell from swelling and possibly bursting,,,
describe the transport of ions by Na+/K+ ATPase,efflux of 3Na+ and influc of 2K+ per 1 hydrolysis of ATP<br>(active transport),,,
what is the nernst equation and what does it describe,"measures membrane potential V<sub>m</sub> (electrical potential difference across a membrane)<br><img src=""paste-ba9640635f9b3463d922a1669fe9438d9502613e.jpg"">",,,
how can you determine whether the dsitribution of ions across a membrane is at equilibrium,"eq when V<sub>m</sub><sup>exp</sup> ≈ V<sub>m</sub><br>if V<sub>m</sub><sup>exp</sup> &gt;&gt; V<sub>m</sub>, or V<sub>mexp</sub> &lt;&lt; Vm then the ions distribution is far from eq and ions must actively be being transported/pumped across the membrane",,,
what is the difference between equilibrium and steady state,"if membrane potential is constant, this means no&nbsp;<u>net</u>&nbsp;current flowing across membrane and flux of cations and anions cancel out<br>ɸ<sub>K+</sub>+ ɸ<sub>Na+</sub>+ ɸ<sub>Cl-&nbsp;</sub>= 0<br>this is the steady state approximation<br>diff from eq as steady state is maintained by expenditure of energy (ATP), cell goes eq when it dies",,,
"rank the ability of anions, cations and nonelectrolytes to cross the cell membrane with reference to their permeability coefficients","cations &lt; anions &lt; nonelectrolytes(uncharged, polar)<br>cations have low permeability coefficient P<sub>d&nbsp;</sub><br>nonelectrolytes have higher P<sub>d</sub><br>anions in between",,,
what is the equation for born energy and what does it describe?,"- describes the electrostatic energy necessary to transfer an ion from water into the membrane<br><img src=""paste-e4186c86dc423e83e824bad35f9453cdf64058b3.jpg""><br>multiply by avogadros number to get answer for one mole of ions",,,
describe the principles of noise analysis and what it measures,"- measures the current across the cell membrane as a function of time<br>- speed of current fluctuations is measures as the autocorrelation function G(τ)<br>- long τc --&gt; channels are opening and closing slowly<br>- short τc --&gt; channels are opening and closing quickly<br><img src=""paste-fcdcd01b719bf0940da90d385085d5d5f5b94018.jpg"">",,,
describe the principles of patch clamp and what it measures,- measures the flow of current across a membrane<br>1. suck a small area of membrane into a pipette (3-4nm across)<br>2. hope membrane patch has a channel and doesn't burst<br>3. measure fluctuations in current as a function of time and applied voltage<br>- 1pA measurable current,,,
describe how is the Na+ gradient across a membrane a store of energy,"ΔG = -50kJ mol-1 (ATP --&gt; ADP + Pi)<br>ΔG = +36kJ mol-1 (for movement of Na+ and K+ by ATPase)<br>there's 14kJmol of energy from ATP hydrolysis which is released as heat --&gt; if ATP hydrolysis occured w/o membrane no work would be done (all would be released as heat)<br>e.g.<br>Na+ gradient facilitates glucose reabsorption absorbtion (glucose reabs by itself is unfavourable, but Na+ transport makes it so Δµ<sub>Na+</sub> + Δµ<sub>G</sub> &lt; 0)",,,
