describe the racemisation of chiral octahedral complexes,"tris(chelate) complexes are chiral e.g. [Cu(en)3] (instead of S and R you have delta and lamda)<br>racemisation is intramolecular and usually faster than ligand exhcnage<br>method 1: involves one end of ligand dissociating then reattaching at another coordination site either via a square pyramidal or trigonal bipyramidal intermediate.<br><img src=""paste-06cbae446f70b6a9fb22e38bcc30c8794cfc2b5c.jpg""><br>method 2:&nbsp;<img src=""paste-c395adb718f7ead7632113610cb919f210b497ef.jpg"">",0
describe the difference between the trans effect and trans influence,"<img src=""paste-f7e98d3f1111737e403c43c3b244b71a3ab14f38.jpg"">",0
what makes a ligand exhibit a strong trans effect and what is the consequence of the trans effect?,"<img src=""paste-42f972f74076a10a35357cc30fa8ae17819609b8.jpg"">",0
describe the trans directing series,"<img src=""paste-aa1b7d29674435a06d52704e2a1ab2a625bf5b58.jpg""><br>mostly just know that I- &gt; Cl- &gt;NH3 (relevant to synthesis of cisplatin)",0
what is a hydroformylation process?,"<img src=""paste-9020a101385199a04b75caad8d200f1fb05eb0f0.jpg""><br><img src=""paste-0fded467f2626121b77d717aa52c92385c3b833d.jpg""><br>all use a Co (I) or Ru (I) catalyst",0
describe the steps in the Union Carbide hydroformylation process,"<img src=""paste-9213b5b1e55815298cbdce90b1223955fb5a4602.jpg"">",0
describe the steps in the Monsanto acetic acid formation process,"methanol --&gt; acetic acid<br><img src=""paste-6bdf264fe6def4f72eea3a479c9134d144b5e160.jpg"">",0
describe the steps in the Tennessee-Eastman acetic anhydride formation process,"<img src=""paste-8e4192bedce465c62ff364df2102e2d429ce9bbc.jpg"">",0
