what are the 4 main classes of biomolecules,nucleic acids<br>proteins<br>carbohydrates<br>lipids,0,,
what are the key differences between the action of small molecule NTs and neuropeptides?,#NAME?,0,,
what are the two major classes of pain relieving drugs?,"1. opioids (morphine, codeine, oxycodone)<br>2. opioid-sparing drugs --&gt; to be used in combination w/ opioids (NSAIDs etc)",0,,
describe the three subtypes of opioid receptors and some of their functions,"1. µ - strong analgesia, constipation, nausea, respiratory depression, tolerance &amp; dependence (nearly all clinical opioids target µOR)<br>2. δ - spinal analgesia, convulsions?, cardiac complications<br>3. κ - moderate analgesia, hallucinations, diuersis",0,,
describe opioid action at the spinal cord,"nociceptors on primary afferent neurons fire after noxious stimuli and synapse in the dorsal horn of spinal cord.<br>two types of sensory fibres/primary afferent neurons --&gt; C fibres and Aδ fibres<br>C fibres are non-myelinated and do slow, throbbing pain. Most opioids act on C fibres]<br>Aδ fibres are lightly-myelinated and do immediate pain.",0,,
describe the physiological consequence of opioid agonism on µORs. refer to receptor location and structure.,µORs are located pre and post synapse.<br>pre synapse --&gt; µORs inhibit Cavs (β𝛾) and adenylyl cyclase (⍺). inhibition of N-type Cavs inhibits NT release and reduces synaptic potentials<br>post synapse --&gt; µORs open GIRK (K+) channels (β𝛾). opening GIRK blocks action potential and hyperpolarises cell membrane<br>Cav inhibition and GIRK opening β𝛾 subunit is main MOA for analgesia,0,,
describe different endogenous opioids and in which cells they act,"1. proenkephalin (nerve cells, adrenal). act on µ<br>2. prodynorphin (nerve cells). act on κ<br>3. ⍺-neoendorphin. activate µ<br>4. pro-opiomelanocortin (pituitary, brain-restricted)<br>A lot of these endogenous opioids/hormones are polypeptides",0,,
describe morphine related opioids and metabolites,- heroin &amp; codeine are prodrugs. they turn into morphine once in body.<br>- morphine has a hydroxyl substituent on phenyl ring (one not closest to nitrogen)<br>- heroin has an acetyl group instead of H (ie its an ester in that position). heroin is turned into active metabolite by an esterase.<br>- codeine has a methyl group instead of H (ie its a methyl ester in that position). codeine is turned into its active metabolite by CYP2D6.,i,,
what does the strength of a G protein signalling depend on?,1. intrinsic efficacy of agonist (not same as potency)<br>2. capacity of receptors to signal<br>3. capacity of cell to translate signal<br>4. tolerance modifies capacity of receptor and cell to signal,,,
how does buprenorphine act on µORs,"buprenorphine is a partial agonist. it binds very tightly to µOR (so other agonists and antagonists cant bind) and produces a weak G protein signal. weaker signal = lessened response (incl no high or respiatory depression), so is used for ppl who have opioid dependence (sorta like methadone)",,,
how/why are 5-HT and NA transporter inhibitors work for analgesia?,"- 5-HT<sub>2,3</sub> 'excites' inhibitory neurons synapsing onto ascending projection neurons &amp; reduces ascending pain transmission<br>- NA acts on ⍺2 (Gi/o) on projection neurons and reduces their excitability",,,
what is the role of prostaglandins (PGE2) in nociception? and what is the MOA of NSAIDs and give some examples,#REF!,,,
what is the difference between pain and nociception,nociception = activation of nociceptors&nbsp;<br>pain = entire physical and psychological experience,,,
what is inflammatory pain?,tissue injury and inflammation processes<br>often ongoing after nociceptor activity --&gt; maintains the pain,,,
what is neuropathic pain?,lesion or disease affecting the somatosensory system<br>causes:<br>1. trauma to peripheral nerves<br>2. central injury<br>3. disease<br>4. chemotherapy,,,
what are the symptoms of chronic pain?,1. spontaneous pain<br>2. allodynia (normally innocuous stimuli interpreted as painful)<br>3. hyperalgesia (painful stimuli more painful),,,
what are the current pharmacotherapies available for chronic pain?,"<div>- anticonvulsants: Gabapentin (blocks Cav)</div><div>- Cav channel blocker</div><div>- antidepressants: TCAs, SNRIs</div><div>- opioids</div><div>- Tramadol (partial opioid agonist + SNRI)</div><div>- topical drugs (capsaicin, anesthetics e.g. lignocaine)</div>",,,
what are some methods used to test chronic pain in animals?,<div>- induce neuropathic pain in animal e.g. sciatic nerve partial damage</div><div>- measure mechanical allodynia: pressure test on paw. measure # of pain responses</div><div>- measure cold allodynia: acetone drop on paw. measure # of pain responses</div><div>- measure mechanical or thermal hyperalgesia: heat or pressure test on paw. measure # of pain responses</div>,,,
how do drugs produce analgesia through targeting the pain pathways?,<div>- decrease ascending transmission (inhibit ascending pathway)</div><div>- activate descending pathway which then release NTs in spinal cord to stop ascending pathway</div>,,,
how is the physiology of the CNS different in those w/ neuropathic pain?,"<div>injury of peripheral afferents causes:</div><div>- hypotrophism (less nerve &amp; brain derived growth factors which support nerves)</div><div>- inflammatory immune response</div><div>- increased expression of diff VGCs such as Nav1.7, Cav, TRPV1</div><div>all this reduces the activation threshold and causes spontaneous pain</div><div><br></div><div>allodynia is caused by nerve sprouting &amp; non-noxious afferents activate pain ciruits</div>",,,
why do opioids not work well in neuropathic pain?,<div>- reduction in µORs&nbsp;</div><div>- µORs not expressed on non-noxious afferents</div><div>- still some reduction in activation of ascending pain pathway but not as effective as acute --&gt; also can't use opioids&nbsp;<i>chronically&nbsp;</i>for chronic pain</div>,,,
"how do Cav blockers, such as ziconotide, treat chronic pain?",<div>- ziconotide targets N-type Cav2.2 which are expressed on&nbsp;<i>all</i>&nbsp;afferents in CNS and PNS so needs to be administered intrathecally</div><div>- greater expression of Cav on afferents in chronic pain so better for targeting allodynia</div><div>- Ca causes NT release so blocking this decreases NT release&nbsp;</div>,,,
how do Gabapentin and Pregablin treat chronic pain?,<div>1. bind to ⍺2δ subunit of Cav2.2 and Cav2.1</div><div>2. decrease Cav expression in central terminal of afferents</div><div>3. less NT release and less excitation</div><div>4. reduces pain transmission</div><div><br></div><div>dosage is hard bc you're trafficking Cav not blocking. not effective for all chronic pain patients. abuse potential</div>,,,
how are TCAs and SNRIs used to treat chronic pain?,<div>- both drug classes block NA and 5HT transporters</div><div>- 5HT activates central descending systems and mood modulation of pain systems</div><div>- NA released from descending pathway to inhibit ascending pathway. NA acts on ⍺2 (Gi/o) on primary afferent terminals to reduce glutamate release and dorsal horn neurons to directly inhibit ascending pain pathway</div>,,,
how is capsaicin used to treat chronic pain?,"<div>- agonises TRPV1 LGICs predominantly expressed on C fibres and sense painful heat (above 40ºC)</div><div>- anti-nociceptive effect attributed to ""defunctionalisation"" of nociceptive fibres</div>",,,
what is the pathogenesis of headaches/migraines?,#NAME?,,,
describe the neurogenic inflammation theory of migraine&nbsp;,1. intracranial blood vessel constricts<br>2. trigeminal ganglion releases CGRP&nbsp;<br>3. TGN projects to trigeminal nucleus caudalis (brainstem)<br>4. TNC projects to ventroposterior medial thalamus&nbsp;<br>5. VMT projects to somatosensory and causes pain<br><br>severity of migraine is proportional to amount of CGRP released. CGRP release triggers CGRP synthesis,,,
what happens in the serotonin system during a migraine,- increase in 5HIAA (primary metbolite) during attack and decrease of 5HT,,,
what are the different types of 5HT receptors?,- 5-HT<sub>1A/B/D/E/F</sub> Gi/o coupled<br>- 5-HT<sub>2A/B/B</sub> Gs coupled,,,
describe 5-HT receptor expression in the trigeminovascular pathway,- trigeminal ganglion: 5-HT<sub>1B/1D</sub><br>- trigeminal nucleus caudalis (brainstem): 5-HT<sub>1B/1D/1F<br></sub>targeting these receptors reduces noxious signalling,,,
what are some drugs used to treat migraines in an acute manner (ie during an attack) and describe their MOA,"- NSAIDs --&gt; inhibit COX1/2 to decrease prostaglandin synthesis<br>- ergotamines --&gt; 5-HT<sub>1D</sub> partial agonist, blocks trigeminal nerve transmission<br>- triptans --&gt; 5-HT<sub>1B/1D/1F</sub> agonists, inhibit trigeminal nerve transmission centrally and peripherally and inhibits release of vasoactive peptides from trigeminal ganglia",,,
what drugs are used to treat migrane prophylactically (ie preventative)?,- β-adrenoreceptor agonists<br>- antidepressants (TCAs)<br>- 5-HT<sub>2</sub> antagonists<br>- anticonvulsants<br>- Cav blocker<br>- CGRP receptor monoclonal antibodies,,,
how do 5-HT<sub>2</sub>&nbsp;antagonists treat migraine prophylactically?,"e.g. pizotifen<br>- prevents 5-HT<sub>2</sub>&nbsp;mediated vasodilation (2º to NO) and consequent inflammation<br>- side effects: weight gain, antimuscarinic",,,
how do anticonvulsants treat migraine prophylactically?,"e.g. sodium valproate, gabapentin<br>- reduce cortical excitability by altering Cav activity<br>- decreases trigeminal neurotransmission<br>- teratogenic",,,
what is epilepsy &amp; what is the cause?,#NAME?,,,
what are the two main types of seizures. what are the specific types of seizures?,"two main:<br>1. focal seizures --&gt; begin in one area of brain<br>2. generalised seizures --&gt; occurs w/ all areas of brain being hyper excitable<br>specific types:<br>- tonic-clonic --&gt; stiff, jerking<br>- absence&nbsp; --&gt; blanking out<br>- myoclonic --&gt; jerking/twitching of muscles<br>- infantile --&gt; stiff &amp; movement of head &amp; limbs back and forth",,,
describe the symptoms and pathogenesis of Dravet syndrome,- severe encephalopathy w high seizure burden<br>- 80% of cases due to loss of function mutation in SCN1A gene (codes for ⍺ subunit of Nav1.1),,,
describe the symptoms and pathogenesis of Lennox-Gastaut syndrome,"- severe encephalopathy w high seizure burden (infantile, tonic, absence)<br>- causes: structural, genetic (D120N mutation --&gt; GABA<sub>A</sub> β3 subunit)",,,
describe the MOA of different antiseizure drugs,"1. modulating VGICs (inhibition &amp; enhancement of inactivation) e.g. lamotrigine<br>2. enhancing GABA-mediated inhibition e.g. benzodiazepines (diazepam PAM of GABA<sub>A</sub>)<br>3. interacing w/ synaptic release machinery e.g. levetiracetam binds synaptic vesicle glycoprotein<br>4. block ionotropic glutamate receptors e.g. perampanel blocks AMPA<br>5. combination of mechanisms e.g. cannabidiol, valproate",,,
describe preclinical models of epilepsy,"- screening against conventional epilepsy drug targets (5HT, GABAA)<br>- diff models used for screening: zebrafish &amp; rodents --&gt; good phenotypic relevance but very low human/patient relevance<br>- KO or KI of SCN1A to test Dravet",,,
describe the neural circuitry that regulates mood,"1. frontal cortex (FC) and hippocampus (HC) involved in cognition<br>2. nucleus accumbens (NAc) and amygdala (Amy) involved in emotion (NAc --&gt; rewarding, Amy --&gt; aversive)<br>3. hypothalamus (Hyp) anc monoamine brainstem nuclei (DR, LC) involved in vegetative symptoms e.g. appetite, energy",,,
describe the monoamine hypothesis of depression,- hypoNA/hypo5-HT state leads to receptor hyperresponsiveness<br>- SO antidepressants lead to ⇑ NA and ⇑ 5-HT<br>- AND down-regulating receptors to normal levels accounts for slow action of drugs,,,
describe the neuroendocrine hypothesis of depression,#NAME?,,,
describe the neurotrophic/neuroplasticity hypothesis of depression,stress &amp; depression associated w:<br>- neuronal loss in pFC and Hyp (has been seen on imaging)<br>- ⇓ BDNF &amp; TrKB receptors<br>- ⇓ neurogenesis<br>- maybe a genetic polymorphism in BDNF which predicts chronicity,,,
describe the current drug classes used to treat depression and give an example,- TCAs e.g. amitryptaline<br>- SSRIs e.g. fluoxetine<br>- SNRIs e.g. venlafaxine<br>- MAO<sub>A</sub> and MOA<sub>B</sub> inhibitors e.g. phenelzine<br>also tetracyclics and NRIs,,,
describe the MOA of SSRIs/SNRIs&nbsp;,"- block presynaptic 5-HT and NA transporters<br>- causes ⇑ [5-HT, NA]",,,
describe the MOA of TCAs w reference to a hypothesis of depression,"- block presynaptic 5-HT and NA transporters<br>- causes ⇑ [5-HT, NA]<br>- monoamine hypothesis states brain is in hypo5HT/hypoNA state, so increasing 5HT and NA rectifies this<br>- TCAs also block mAChR, 5HTR, ⍺-adrenoreceptors ∴⇑ side effects",,,
describe the MOA of MAO inhibitors&nbsp;,- inhibit breakdown of 5HT and NA<br>- increases cytoplasmic conc of monoamines<br>- increases leakage of monoamines into synapse,,,
describe the MOA of tetracyclic antidepressants,- block ⍺2 adrenoceptors<br>- causes increase 5HT and NA release,,,
describe the MOA of St John's Wart,"- block 5HT, NA, DA, GABA and glutamate reuptake by reducing Na<sup>+</sup> gradient",,,
compare the different side effects of different drug classes used to treat depression,"- TCAs have the most antimuscarinic effects (eg blurred vision, dry mouth) and cardiovascular (eg arrythmias)<br>- SSRIs have most gastrointestinal side effects (eg nausea) and CNS (eg dizziness)<br>- MAO-I's have cheese reaction (if you eat food w tryamine eg cheese it can be fatal)",,,
describe how antidepressants treat depression w reference to the monoamine hypothesis,- down-regulate postsynaptic NA (β-adrenoceptors) and/or 5-HT2 recpetors (Gs)<br>- increase activity/sensitivity of postsynaptic 5-HT1 (Gi/o) receptors in hippocampus<br>- desensitisation of presynaptic ⍺2 adrenoceptors (Gi/o) and 5-HT1 receptors which control 5HT and NA release --&gt; facilitates monoamine release<br>Net effect of chronic treatment is an enhancement of monoaminergic function&nbsp;,,,
describe how antidepressants treat depression w reference to the neurotrophic/neuroplasticity hypothesis&nbsp;,"- antidepressants enhance BDNF signalling, TrKB receptors and neurogenesis<br>--&gt; BDNF stimulates SERT transcription in raphe nuclei, 5HT receptor activation stimulates BDNF expression, thus ⇑ 5HT synthesis, release and cell function this may work to restore network function and in turn mood<br>- 5HT and NA promote neurogenesis by 5-HT<sub>1A</sub>, 5-HT<sub>2B</sub> and β-adrenoceptor stimulation and ⍺2-adrenoceptor blockade",,,
describe how antidepressants treat depression w reference to the neuroendocrine hypothesis,"- antidepressants are associated w glucocorticoid receptor (GR) phosphorylation via PKA, which ⇑ inhibition of GR to promote neurogenesis in Hipp<br>- hippocampal neurogenesis is necessary for restoration of HPA axis (ie to inhibit stress response)",,,
what is drug addiction?,"""a state where drug use continues in spite of serious potential or actual harm to the user or others""<br>""addiction is a brain disorder that results from a mix of genetic, neural, environmental and social causes""",,,
describe the role of genetics in addiction w reference to impulsivity,- alcoholism is strongest in terms of genetics<br>- highly impulsive (HI) humans have a high risk of drug abuse&nbsp;<br>- HI humans have different cortical structures and dopamine receptor expression,,,
describe how chronic drug uses effects neuroplasticity with reference to chronic opioid use,"neuroplasticity effected by:<br>1. tolerance --&gt; ⇓ response to same dose, can be due to changed receptor response<br>2. counter-adaptations --&gt; attempts to compensate for ongoing drug effects on cells, causes withdrawal and craving<br><br>with chronic opioid use, AC signalling becomes hypertrophied (up-regulated) which causes ⇑ cAMP and ⇑ excitation",,,
describe the important sites of opioid action in the brain,"- VTA --&gt; NAc is the reward pathway. opioids stimulate µORs on dopamine neurons in this pathway to cause euphoria<br>- medulla --&gt; respiratory depression, depression, blood pressure, arousal, nausea",,,
"describe how µOR antagonists are used to treat opioid addiction, describe the clinical effects and give an example",naltrexone<br>- occupies receptor and prevents binding&nbsp;<br>- need to detox before use<br>- poor compliance<br>- high relapse rate,,,
"describe how µOR agonists are used to treat opioid addiction, describe the clinical effects and give an example",methadone<br>- agonist w/ long half life ~22h --&gt; good for dosing<br>- stops withdrawal and craving w/o intoxication at correct dose<br>- overdose possible,,,
"describe how µOR partial agonists are used to treat opioid addiction, describe the clinical effects and give an example","buprenorphine&nbsp;<br>- partial agonist, prevents full agonists from activating receptor&nbsp;<br>- reduces craving<br>- prevents withdrawal&nbsp;<br>- less overdose risk than methadone",,,
describe the MOA of alcohol,- enhance GABAergic and glycinergic synaptic transmission --&gt; ⇑ inhibition<br>- inhibition Cav<br>- activation Kav<br>- inhibition of GABA receptor function<br>- inhibition of adenosine transport,,,
describe some of the treatments used in alcohol addiction,#NAME?,,,
describe how making alcohol unpleasant treats alcohol addiction. give an example of the drug and its MOA,"disulfiram<br>- inhibits aldehyde dehydrogenase<br>- causes flush, palpitations, nausea if you drink alcohol<br>- can't be used to treat cravings but can be used to treat cue-induced drug-seeking",,,
describe how acamprosate is used to treat alcohol addiction,- may act via inhibition of NMDA receptor (may alter plasticity)<br>- may alter GABA and glutmate synaptic transmission<br>-similar efficacy to naltrexone&nbsp;,,,
describe how topiramate is used to treat alcohol addiction,"- antiepileptic<br>- may alter phosphorylation of Nav, Cav, GABA &amp; glutamate channels<br>- may ⇑ GABA and ⇓glutamate synaptic transmission<br>- may have better treatment outcomes in ppl w kainate polymorphisms<br>- significant reduction&nbsp; in drinking but variable results",,,
what is the difference between sedatation and hypnosis,"sedation = ⇓ excitement, vigilance and physiological arousal to induce relaxation, possibly sleepy<br>hypnosis = ability to induce drowsiness and sleep&nbsp;",,,
describe the MOA of benzodiazepines,"- PAM of GABA<sub>A</sub>. binds between ⍺ and 𝛾 subunits (GABA<sub>A</sub> is a pentamer, on postsynaptic neuron)<br>- ⇑ GABA's&nbsp;affinity for receptor and as a result ⇑ # of channel openings<br>- causes Cl- influx in post-synaptic neuron causes ⇑ hyperpolarisation and ⇓ in excitability",,,
describe the MOA of barbiturates,- PAM of GABAA<br>- agonist at very high doses<br>- ⇑ length of channel opening,,,
describe how the type ⍺ subunit of a GABA<sub>A </sub>receptor determines the effect of a benzodiazepine,"⍺1 --&gt; sedative/hypnotic, anticonvulsant&nbsp;<br>⍺2 and ⍺3 --&gt; anxiolytic&nbsp;<br>⍺3 and ⍺3 --&gt; muscle relaxing",,,
describe the MOA of Z-drugs,"- not benzodiazepines because they lack benzodiazepine structure but they act at benzo site on GABAA<br>- show some preference for ⍺1 (sedative, hypnotic)<br>- may produce bizarre sleep behaviours",,,
describe the MOA of antihistamine use in sedation,#NAME?,,,
describe the MOA of melatonin use in sedation,- endogenous melatonin is synthesised in pineal gland<br>- melatonin is an agonist at MT1 and MT2 receptors (both Gi/o coupled GPCRs)<br>- MT1 --&gt; activation promotes sleep onset<br>- MT2 --&gt; activation shifts circadian timing<br>,,,
identify the NTs that are present in the ARAS (ascending reticular activation system) and the NTs that are sleep promoting,"ARAS = wakefulness promoting --&gt; NA, 5HT, ACh, dopamine, histamine<br>sleep promoting --&gt; GABA, adenosine, melatonin",,,
what are some problems associated with benzodiazepine usage?,"- shouldn't be used for &gt;1 month<br>- when stopping, udose needs to be tapered down<br>- large dependence liability<br>- strange sleep behaviours<br>- amnesia<br>- combination with other sedatives (eg alcohol) can be v dangerous",,,
describe the advantages and disadvantages of using benzodiazepines to treat anxiety,"recall: ⍺2 and ⍺3 subunits of GABAA promote anxiolytic<br>alprazolam and clonazepam used bc they show preference for ⍺2<br>advantage --&gt; rapid onset ∴ good for acute treatment<br>disadvantage --&gt; dependence potential, drowsiness",,,
what is anxiety and what brain regions does it involve,"""state of preparation for danger (eg ⇑ arousal) but no immediate danger""<br>- amygdala is up-regulated in fear disorders&nbsp;<br>- anxiety thought to be result of problems w synaptic plasticity in Amy circuits",,,
what are the current treatments for anxiety and briefly describe their MOA,- cognitive behavioural therapy<br>- benzodiazepines --&gt; GABAA PAM<br>- SSRIs<br>- SNRIs<br>- TCAs: prevent NA and 5HT reuptake<br>- pregabalin --&gt; GABA analogue that actions on ⍺2δ subtype of Cav to ⇑ GABA levels<br>- buspirone --&gt; partial 5HT1A (Gi/o) agonist. moderate efficacy,,,
what is schizophrenia?,"- a disorder of higher cognitive functioning caused by abnormalities in the brain (structural - white matter, ventricles, neurochemical - NTs, receptors)<br>- neurodevelopmental disorder&nbsp;<i>not&nbsp;</i>neurodegenerative<br>cause:<br>- genetic?<br>- pre/perinatal factors<br>- drug use&nbsp;<br>- stress from major life events",,,
describe the general MOA of antipsychotics,- all are D2 dopamine receptor (Gi) antagonists&nbsp;<br>- linear correlation between therapeutic efficacy and affinity for D2,,,
describe the dopamine hypothesis of schizophrenia,"dopaminergic dysfunction is what causes schizophrenia<br>1. ⇑ DA levels, synthesis and release in NAc, Hipp<br>2. ⇓ other NTs (eg GABA, glutmate) lead to DA dysregulation<br>3. D2 receptors are supersensitive --&gt; blockade ⇓ overactivity and alleviates psychosis",,,
what are the +ve and -ve symptoms of schizophrenia,positive:<br>- hallucinations<br>- delusions<br>- disorganised thought &amp; speech<br>negative:<br>- anhedonia<br>- aviolation/apathy (⇓ goal directed activities)<br>- flattened effect (reduced mood),,,
which neural pathways are responsible for the +ve and -ve symptoms of schizophrenia,"mesolimbic pathway: VTA --&gt; NAc, Amy, Hipp (dopaminergic). Hyperactivity causes positive symptoms<br>mesocortical pathway: VTA --&gt; FC (dopaminergic). Hyperactivity causes negative symptoms<br>nigrostriatal pathway: substantia nigra --&gt; dorsal striatum. Hyperactivity causes cognitive symptoms. Hyperactivity correlates w symptom severity",,,
what are the major classes of typical antipsychotics and give an example. what is their therapeutic effect?,1. phenothiazines eg chlorpromazine<br>2. butyrophenones eg haloperidol<br>3. thioxanthenes<br>these ameliorate the positive symptoms of schizophrenia but have little effect on negative and cognitive symptoms.,,,
what are the major classes of atypical antipsychotics and give an example. what is their therapeutic effect?,#NAME?,,,
describe the receptor actions of typical antipsychotics,"- potent D2 receptor agonists (80% occupany for therapeutic, slow dissociation)<br>- moderate affinity for ⍺-adrenoceptors and 5-HT2 receptors<br>- weak affinity for D1, D4, H1 and mACh",,,
describe the receptor actions of atypical antipsychotics,"- D2 antagonism w high affinity and/or selectivity, 60% occupancy at therapeutic doses<br>- high affinity for 5-HT2 (up to 90% occupancy)<br>- moderate affinity for ⍺-adrenoceptors and D3<br>- clozapine &amp; olanzapine have high affinity for D4",,,
compare and contrast the side effects of typical and atypical antipsychotics,typical:<br>- movement disorders (associated w D2)<br>- anticholinergic<br>- endocrine (weight gain associated w 5-HT2A)<br>atypical:<br>- agranulocytosis (clozapine)<br>- metabolic syndrome&nbsp;,,,
how do antipsychotics work in the short term &amp; long term,short term:<br>- blocking D2 autoreceptors ⇑ DA release<br>- blocking supersensitive D2 postsynaptic receptors ⇓ DA inhibition<br>long term:<br>- upregulation of presynaptic D2 ⇓ DA release<br>- blockade and upregulation of D2 restores homeostasis,,,
what is dementia,"""clinical syndrome associated w impaired memory and other intellectual functions which intefere with normal functioning and impair quality of life""<br>- progressive decline in mental function<br>- alzheimers disease accounts for 70% of dementia cases<br>- stroke and parkinsons each account for 15% of dementia cases",,,
describe the clinical features of alzheimers,"- changes in memory and cognition<br>- changes in spatial and temporal orientation<br>- difficulty forming new memories<br>- altered judgement<br>- +/- moodiness, depression, apathy",,,
identify &amp; describe the pathological features of alzheimers,"1. cerebral atrophy and ventricular enlargement (cavities that store CSF)<br>2. neuronal loss with gliosis (particularly cholinergic neurons, gliosis = scarring, occurs in Hipp, Amy, Cortex)<br>3. amyloid plaques (aggregation of amyloid proteins, most commonly amyloid-β peptide (39-44aa's long))<br>4. neurofibrillary tangles (abnormal bunches of filament in neurons, hyperphosphorylated tau protein (microtubule associated protein))",,,
